{
  "$schema": "http://json-schema.org/draft-07/schema#",
  "$id": "discovery-release-manifest-schema.json",
  "title": "Microsoft Discovery Application Release Manifest",
  "description": "Schema for ring-specific application release manifests under docs/discovery-app/releases/manifests/. These manifests require human/CODEOWNER approval and passing required checks before merge.",
  "type": "object",
  "required": [
    "ring",
    "latestVersion",
    "minimumVersion",
    "schemaVersion",
    "platforms",
    "releaseNotesUrl",
    "releaseNotesSummary",
    "releasedAt"
  ],
  "additionalProperties": false,
  "properties": {
    "ring": {
      "type": "string",
      "minLength": 1,
      "maxLength": 32,
      "pattern": "^[a-z][a-z0-9-]*$",
      "description": "Release ring identifier. The validator also requires this to equal the manifest filename."
    },
    "latestVersion": {
      "$ref": "#/definitions/semanticVersion"
    },
    "minimumVersion": {
      "$ref": "#/definitions/semanticVersion"
    },
    "schemaVersion": {
      "type": "integer",
      "const": 1
    },
    "platforms": {
      "type": "object",
      "required": ["osx-arm64", "win-arm64", "win-x64"],
      "additionalProperties": false,
      "properties": {
        "rhel-x64": {
          "$ref": "#/definitions/rhelPlatformRelease"
        },
        "osx-arm64": {
          "allOf": [
            { "$ref": "#/definitions/platformRelease" },
            {
              "properties": {
                "installerUrl": {
                  "enum": [
                    "https://aka.ms/discovery/download/osx/previous",
                    "https://aka.ms/discovery/download/osx/current",
                    "https://aka.ms/discovery/download/preview/osx/previous",
                    "https://aka.ms/discovery/download/preview/osx/current"
                  ]
                }
              }
            }
          ]
        },
        "win-arm64": {
          "allOf": [
            { "$ref": "#/definitions/platformRelease" },
            {
              "properties": {
                "installerUrl": {
                  "enum": [
                    "https://aka.ms/discovery/download/arm64/previous",
                    "https://aka.ms/discovery/download/arm64/current",
                    "https://aka.ms/discovery/download/preview/arm64/previous",
                    "https://aka.ms/discovery/download/preview/arm64/current"
                  ]
                }
              }
            }
          ]
        },
        "win-x64": {
          "allOf": [
            { "$ref": "#/definitions/platformRelease" },
            {
              "properties": {
                "installerUrl": {
                  "enum": [
                    "https://aka.ms/discovery/download/previous",
                    "https://aka.ms/discovery/download/current",
                    "https://aka.ms/discovery/download/preview/x64/previous",
                    "https://aka.ms/discovery/download/preview/x64/current"
                  ]
                }
              }
            }
          ]
        }
      }
    },
    "releaseNotesUrl": {
      "type": "string",
      "maxLength": 2048,
      "pattern": "^(|https://[^\\s]+)$"
    },
    "releaseNotesSummary": {
      "type": "string",
      "maxLength": 4000
    },
    "releasedAt": {
      "type": "string",
      "maxLength": 40,
      "format": "date-time"
    }
  },
  "definitions": {
    "rhelPlatformRelease": {
      "description": "Optional RHEL x64 release. Installer URL must be a listed RHEL download URL or the exact pending-publish placeholder.",
      "type": "object",
      "required": ["installerUrl", "sha256"],
      "additionalProperties": false,
      "properties": {
        "installerUrl": {
          "type": "string",
          "enum": [
            "PLACEHOLDER_PENDING_PUBLISH",
            "https://aka.ms/discovery/download/rhel/previous",
            "https://aka.ms/discovery/download/rhel/current",
            "https://aka.ms/discovery/download/preview/rhel/previous",
            "https://aka.ms/discovery/download/preview/rhel/current"
          ]
        },
        "sha256": {
          "$ref": "#/definitions/platformRelease/properties/sha256"
        }
      }
    },
    "semanticVersion": {
      "type": "string",
      "maxLength": 64,
      "pattern": "^[0-9]+\\.[0-9]+\\.[0-9]+(?:-[0-9A-Za-z.-]+)?(?:\\+[0-9A-Za-z.-]+)?$"
    },
    "platformRelease": {
      "type": "object",
      "required": ["installerUrl", "sha256"],
      "additionalProperties": false,
      "properties": {
        "installerUrl": {
          "type": "string",
          "pattern": "^https://[^\\s]+$",
          "maxLength": 2048
        },
        "sha256": {
          "type": "string",
          "maxLength": 64,
          "pattern": "^[0-9a-f]{64}$"
        }
      }
    }
  }
}
